{
  "formatVersion": 1,
  "pageId": "001",
  "layer": 8,
  "language": "mixed",
  "blocks": [
    {
      "type": "paragraph",
      "content": [
        {
          "type": "annotated",
          "text": "下総の国",
          "reading": "しもうさのくに",
          "language": "ja",
          "noteIds": ["note-shimosa"]
        },
        {
          "type": "annotated",
          "text": "葛飾郡",
          "reading": "かつしかのこおり",
          "language": "ja",
          "noteIds": ["note-katsushika"]
        },
        {
          "type": "annotated",
          "text": "真間の里",
          "reading": "ままのさと",
          "language": "ja",
          "noteIds": ["note-mama"]
        },
        {
          "type": "text",
          "text": "に、"
        },
        {
          "type": "annotated",
          "text": "勝四郎",
          "reading": "かつしろう",
          "language": "ja",
          "noteIds": ["note-katsushiro"]
        },
        {
          "type": "text",
          "text": "という"
        },
        {
          "type": "annotated",
          "text": "男",
          "reading": "おとこ",
          "language": "ja",
          "noteIds": ["note-man"]
        },
        {
          "type": "text",
          "text": "が"
        },
        {
          "type": "annotated",
          "text": "あった",
          "reading": "あった",
          "language": "ja",
          "noteIds": ["note-atta"]
        },
        {
          "type": "text",
          "text": "。"
        }
      ],
      "audioSegments": [
        {
          "id": "opening-sentence",
          "text": "しもうさのくに、かつしかのこおり、ままのさとに、かつしろうというおとこがあった。",
          "start": 0,
          "end": 9
        }
      ]
    },
    {
      "type": "paragraph",
      "content": [
        {
          "type": "annotated",
          "text": "祖父の代",
          "reading": "そふのだい",
          "language": "ja",
          "noteIds": ["note-sofunodai"]
        },
        {
          "type": "text",
          "text": "から"
        },
        {
          "type": "annotated",
          "text": "久しく",
          "reading": "ひさしく",
          "language": "ja",
          "noteIds": ["note-hisashiku"]
        },
        {
          "type": "text",
          "text": "この里に"
        },
        {
          "type": "annotated",
          "text": "すみ",
          "reading": "すみ",
          "language": "ja",
          "noteIds": ["note-sumi"]
        },
        {
          "type": "text",
          "text": "、"
        },
        {
          "type": "annotated",
          "text": "田畑",
          "reading": "たはた",
          "language": "ja",
          "noteIds": ["note-tahata"]
        },
        {
          "type": "text",
          "text": "も"
        },
        {
          "type": "annotated",
          "text": "たくさん",
          "reading": "たくさん",
          "language": "ja",
          "noteIds": ["note-takusan"]
        },
        {
          "type": "annotated",
          "text": "もって",
          "reading": "もって",
          "language": "ja",
          "noteIds": ["note-motte"]
        },
        {
          "type": "annotated",
          "text": "家",
          "reading": "いえ",
          "language": "ja",
          "noteIds": ["note-ie"]
        },
        {
          "type": "text",
          "text": "も"
        },
        {
          "type": "annotated",
          "text": "豊か",
          "reading": "ゆたか",
          "language": "ja",
          "noteIds": ["note-yutaka"]
        },
        {
          "type": "text",
          "text": "に"
        },
        {
          "type": "annotated",
          "text": "暮らしていた",
          "reading": "くらしていた",
          "language": "ja",
          "noteIds": ["note-kurashiteita"]
        },
        {
          "type": "text",
          "text": "が、"
        },
        {
          "type": "annotated",
          "text": "生れつき",
          "reading": "うまれつき",
          "language": "ja",
          "noteIds": ["note-umaretsuki"]
        },
        {
          "type": "annotated",
          "text": "無頓着",
          "reading": "むとんじゃく",
          "language": "ja",
          "noteIds": ["note-mutonchaku"]
        },
        {
          "type": "text",
          "text": "で"
        },
        {
          "type": "annotated",
          "text": "のんき",
          "reading": "のんき",
          "language": "ja",
          "noteIds": ["note-nonki"]
        },
        {
          "type": "text",
          "text": "な"
        },
        {
          "type": "annotated",
          "text": "性質",
          "reading": "せいしつ",
          "language": "ja",
          "noteIds": ["note-seishitsu"]
        },
        {
          "type": "text",
          "text": "から、"
        },
        {
          "type": "annotated",
          "text": "農業",
          "reading": "のうぎょう",
          "language": "ja",
          "noteIds": ["note-nogyo"]
        },
        {
          "type": "text",
          "text": "を"
        },
        {
          "type": "annotated",
          "text": "煩わしい",
          "reading": "わずらわしい",
          "language": "ja",
          "noteIds": ["note-wazurawashii"]
        },
        {
          "type": "text",
          "text": "ものだと, he disliked it, and in the end he fell into poverty."
        }
      ],
      "audioSegments": [
        {
          "id": "former-prosperity",
          "text": "そふのだいから、ひさしくこのさとにすみ、たはたもたくさんもっていえもゆたかにくらしていたが",
          "start": 0,
          "end": 15
        },
        {
          "id": "temperament-and-farming",
          "text": "うまれつき、むとんじゃくで、のんきなせいしつから、のうぎょうをわずらわしいものだと",
          "start": 16,
          "end": 25
        }
      ]
    }
  ]
}
