{
  "formatVersion": 1,
  "pageId": "001",
  "layer": 2,
  "language": "mixed",
  "blocks": [
    {
      "type": "paragraph",
      "content": [
        {
          "type": "text",
          "text": "In "
        },
        {
          "type": "annotated",
          "text": "下総の国",
          "reading": "しもうさのくに",
          "language": "ja",
          "noteIds": ["note-shimosa"]
        },
        {
          "type": "text",
          "text": ", in "
        },
        {
          "type": "annotated",
          "text": "葛飾郡",
          "reading": "かつしかのこおり",
          "language": "ja",
          "noteIds": ["note-katsushika"]
        },
        {
          "type": "text",
          "text": ", in "
        },
        {
          "type": "annotated",
          "text": "真間の里",
          "reading": "ままのさと",
          "language": "ja",
          "noteIds": ["note-mama"]
        },
        {
          "type": "text",
          "text": ", there lived a man named Katsushirō."
        }
      ]
    },
    {
      "type": "paragraph",
      "content": [
        {
          "type": "text",
          "text": "His family had lived in the village since his grandfather’s generation. They owned many fields and lived prosperously. But Katsushirō was carefree and unconcerned by nature. He regarded farming as troublesome, and in the end he fell into poverty."
        }
      ]
    }
  ]
}
