{
  "formatVersion": 1,
  "pageId": "001",
  "layer": 4,
  "language": "mixed",
  "blocks": [
    {
      "type": "paragraph",
      "content": [
        {
          "type": "annotated",
          "text": "下総の国",
          "reading": "しもうさのくに",
          "language": "ja",
          "noteIds": ["note-shimosa"]
        },
        {
          "type": "annotated",
          "text": "葛飾郡",
          "reading": "かつしかのこおり",
          "language": "ja",
          "noteIds": ["note-katsushika"]
        },
        {
          "type": "annotated",
          "text": "真間の里",
          "reading": "ままのさと",
          "language": "ja",
          "noteIds": ["note-mama"]
        },
        {
          "type": "text",
          "text": "に、"
        },
        {
          "type": "annotated",
          "text": "勝四郎",
          "reading": "かつしろう",
          "language": "ja",
          "noteIds": ["note-katsushiro"]
        },
        {
          "type": "text",
          "text": "という"
        },
        {
          "type": "annotated",
          "text": "男",
          "reading": "おとこ",
          "language": "ja",
          "noteIds": ["note-man"]
        },
        {
          "type": "text",
          "text": "が"
        },
        {
          "type": "annotated",
          "text": "あった",
          "reading": "あった",
          "language": "ja",
          "noteIds": ["note-atta"]
        },
        {
          "type": "text",
          "text": "。"
        }
      ],
      "audioSegments": [
        {
          "id": "opening-sentence",
          "text": "しもうさのくに、かつしかのこおり、ままのさとに、かつしろうというおとこがあった。",
          "start": 0,
          "end": 9
        }
      ]
    },
    {
      "type": "paragraph",
      "content": [
        {
          "type": "annotated",
          "text": "祖父の代",
          "reading": "そふのだい",
          "language": "ja",
          "noteIds": ["note-sofunodai"]
        },
        {
          "type": "text",
          "text": "から"
        },
        {
          "type": "annotated",
          "text": "久しく",
          "reading": "ひさしく",
          "language": "ja",
          "noteIds": ["note-hisashiku"]
        },
        {
          "type": "text",
          "text": "この里に"
        },
        {
          "type": "annotated",
          "text": "すみ",
          "reading": "すみ",
          "language": "ja",
          "noteIds": ["note-sumi"]
        },
        {
          "type": "text",
          "text": ", his family owned many fields and lived prosperously. But Katsushirō was carefree and unconcerned by nature. He regarded farming as troublesome, and in the end he fell into poverty."
        }
      ],
      "audioSegments": [
        {
          "id": "family-continuity",
          "text": "そふのだいから、ひさしくこのさとにすみ",
          "start": 0,
          "end": 4
        }
      ]
    }
  ]
}
