{
  "formatVersion": 1,
  "pageId": "002",
  "layer": 1,
  "language": "en",
  "blocks": [
    {
      "type": "paragraph",
      "content": [
        {
          "type": "text",
          "text": "As things continued in this way, many of Katsushirō’s relatives also began to keep him at a distance. He felt the humiliation deeply. Wanting somehow to restore the fortunes of his house, he turned the matter over in every direction."
        }
      ]
    }
  ]
}
