{
  "formatVersion": 1,
  "pageId": "001",
  "layer": 7,
  "language": "mixed",
  "blocks": [
    {
      "type": "paragraph",
      "content": [
        {
          "type": "annotated",
          "text": "下総の国",
          "reading": "しもふさのくに",
          "language": "ja",
          "noteIds": ["note-shimosa"]
        },
        {
          "type": "annotated",
          "text": "葛飾郡",
          "reading": "かつしかのこほり",
          "language": "ja",
          "noteIds": ["note-katsushika"]
        },
        {
          "type": "annotated",
          "text": "真間の郷",
          "reading": "ままのさと",
          "language": "ja",
          "noteIds": ["note-mama"]
        },
        {
          "type": "text",
          "text": "に、"
        },
        {
          "type": "annotated",
          "text": "勝四郎",
          "reading": "かつしらう",
          "language": "ja",
          "noteIds": ["note-katsushiro"]
        },
        {
          "type": "text",
          "text": "といふ"
        },
        {
          "type": "annotated",
          "text": "男",
          "reading": "をとこ",
          "language": "ja",
          "noteIds": ["note-man"]
        },
        {
          "type": "annotated",
          "text": "ありけり",
          "reading": "ありけり",
          "language": "ja",
          "noteIds": ["note-arikeri"]
        },
        {
          "type": "text",
          "text": "。"
        }
      ]
    },
    {
      "type": "paragraph",
      "content": [
        {
          "type": "annotated",
          "text": "祖父",
          "reading": "おほぢ",
          "language": "ja",
          "noteIds": ["note-grandfather"]
        },
        {
          "type": "text",
          "text": "より"
        },
        {
          "type": "annotated",
          "text": "旧しく",
          "reading": "ひさしく",
          "language": "ja",
          "noteIds": ["note-hisashiku"]
        },
        {
          "type": "text",
          "text": "ここに"
        },
        {
          "type": "annotated",
          "text": "住み",
          "reading": "すみ",
          "language": "ja",
          "noteIds": ["note-sumi"]
        },
        {
          "type": "text",
          "text": "、"
        },
        {
          "type": "annotated",
          "text": "田畠",
          "reading": "たばた",
          "language": "ja",
          "noteIds": ["note-tabata"]
        },
        {
          "type": "annotated",
          "text": "あまた",
          "reading": "あまた",
          "language": "ja",
          "noteIds": ["note-amata"]
        },
        {
          "type": "annotated",
          "text": "主づきて",
          "reading": "ぬしづきて",
          "language": "ja",
          "noteIds": ["note-nushizukite"]
        },
        {
          "type": "text",
          "text": "、"
        },
        {
          "type": "annotated",
          "text": "家豊か",
          "reading": "いへゆたか",
          "language": "ja",
          "noteIds": ["note-ieyutaka"]
        },
        {
          "type": "text",
          "text": "に"
        },
        {
          "type": "annotated",
          "text": "暮しける",
          "reading": "くらしける",
          "language": "ja",
          "noteIds": ["note-kurashikeru"]
        },
        {
          "type": "text",
          "text": "が、"
        },
        {
          "type": "annotated",
          "text": "生長りて",
          "reading": "ひととなりて",
          "language": "ja",
          "noteIds": ["note-hitonarite"]
        },
        {
          "type": "annotated",
          "text": "物にかかはらぬ",
          "reading": "ものにかかはらぬ",
          "language": "ja",
          "noteIds": ["note-kakawaranu"]
        },
        {
          "type": "annotated",
          "text": "性",
          "reading": "さが",
          "language": "ja",
          "noteIds": ["note-saga"]
        },
        {
          "type": "text",
          "text": "より、"
        },
        {
          "type": "annotated",
          "text": "農作",
          "reading": "なりはひ",
          "language": "ja",
          "noteIds": ["note-nariwai"]
        },
        {
          "type": "text",
          "text": " he came to regard as hateful, and so, at last, the household fell into poverty."
        }
      ],
      "audioSegments": [
        {
          "id": "disposition",
          "text": "ものにかかわらぬさがより",
          "start": 15,
          "end": 17
        },
        {
          "id": "farming",
          "text": "なりわい",
          "start": 18,
          "end": 18
        }
      ]
    }
  ]
}
